{
  "companyName": "FARMACIA INSTITUCIONAL S A S",
  "documentType": "NIT",
  "taxId": "14699744621",
  "relatedParties": [
    {
      "identificationType": "Cédula de Ciudadanía",
      "identificationNumber": "1380230151",
      "relationshipType": "REPRS LEGAL PRIN",
      "firstName": "TOVAR",
      "lastName": "OSORIO LEON ALEXANDER"
    },
    {
      "identificationType": "Cédula de Ciudadanía",
      "identificationNumber": "5205335354",
      "relationshipType": "REPRS LEGAL SUPL",
      "firstName": "OLGA LUCIA",
      "lastName": "RUGE TOVAR"
    },
    {
      "identificationType": "Cédula de Ciudadanía",
      "identificationNumber": "79474741",
      "relationshipType": "Contador",
      "firstName": "MARIA DEL CARMEN",
      "lastName": "VALDERRAMA ESQUIVEL WILIAN ANDRES"
    },
    {
      "identificationType": "Cédula de Ciudadanía",
      "identificationNumber": "1379663905",
      "relationshipType": "Revisor Fiscal Principal",
      "firstName": "MILCIADES",
      "lastName": "TAPIAS MENDIETA"
    }
  ],
  "country": "COLOMBIA"
}