{
  "companyName": "G4S SECURE SOLUTIONS COLOMBIA S A",
  "documentType": "NIT",
  "taxId": "860013951",
  "relatedParties": [
    {
      "firstName": "DAVID ISAAC",
      "lastName": "BUCKMAN",
      "identificationType": "Cédula de Extranjería",
      "identificationNumber": "19740758",
      "noveltyType": "Registro",
      "participationPercentage": "0"
    }
  ],
  "country": "Colombia"
}