{
  "companyName": "GEOKINETICS INTERNACIONAL, INC.",
  "documentType": "NIT",
  "taxId": "860006152-8",
  "relatedParties": [
    {
      "firstName": "NARCISO",
      "lastName": "IVANUEL CHIQUILLO CONDE",
      "identificationType": "C.C.",
      "identificationNumber": "17124736",
      "relationshipType": "Representante Legal"
    },
    {
      "firstName": "JORGE",
      "lastName": "RODRIGUEZ ROJAS",
      "identificationType": "C.C.",
      "identificationNumber": "1744414",
      "relationshipType": "Apoderado General"
    },
    {
      "firstName": "JOSE",
      "lastName": "MANUEL TAMAYO OLARTE",
      "identificationType": "C.C.",
      "identificationNumber": "19303534",
      "relationshipType": "Apoderado General"
    },
    {
      "firstName": "VICTOR",
      "lastName": "URCICIO GOMEZ GUTIERREZ",
      "identificationType": "C.C.",
      "identificationNumber": "8041476",
      "relationshipType": "Apoderado General"
    },
    {
      "firstName": "RAFAEL",
      "lastName": "CASILLO CHARRY",
      "identificationType": "C.C.",
      "identificationNumber": "79370170",
      "relationshipType": "Apoderado General"
    },
    {
      "companyName": "ERNST & YOUNG AUDIT LTDA",
      "identificationType": "",
      "identificationNumber": "000008600088905",
      "relationshipType": "Revisor Fiscal"
    },
    {
      "firstName": "FABIO",
      "lastName": "MONTAÑELEGRE BUENAÑA",
      "identificationType": "C.C.",
      "identificationNumber": "36373989",
      "relationshipType": "Revisor Fiscal"
    }
  ],
  "country": "COLOMBIA"
}