{
  "companyName": "PAR SERVICIOS INTEGRALES S A",
  "documentType": "NIT",
  "taxId": "830067329",
  "relatedParties": [
    {
      "firstName": "ANDRES LEONARDO",
      "lastName": "RODRIGUEZ RAMIREZ",
      "identificationType": "Cédula de Ciudadanía",
      "identificationNumber": "80074122",
      "noveltyType": "Registro",
      "participationPercentage": "14.99"
    },
    {
      "firstName": "LUIS ALBERTO",
      "lastName": "RODRIGUEZ SAMUDIO",
      "identificationType": "Cédula de Ciudadanía",
      "identificationNumber": "19193304",
      "noveltyType": "Registro",
      "participationPercentage": "29.98"
    },
    {
      "firstName": "DIANA PAOLA",
      "lastName": "RODRIGUEZ RAMIREZ",
      "identificationType": "Cédula de Ciudadanía",
      "identificationNumber": "52817177",
      "noveltyType": "Registro",
      "participationPercentage": "14.99"
    },
    {
      "firstName": "ESTEFANIA",
      "lastName": "CORREDOR RODRIGUEZ",
      "identificationType": "Cédula de Ciudadanía",
      "identificationNumber": "1019026903",
      "noveltyType": "Registro",
      "participationPercentage": "5.02"
    },
    {
      "firstName": "LUIS MIGUEL",
      "lastName": "ZUBIETA URIBE",
      "identificationType": "Cédula de Ciudadanía",
      "identificationNumber": "79939362",
      "noveltyType": "Registro",
      "participationPercentage": "14.99"
    },
    {
      "firstName": "CAROLINA",
      "lastName": "CORREDOR RODRIGUEZ",
      "identificationType": "Cédula de Ciudadanía",
      "identificationNumber": "52799584",
      "noveltyType": "Registro",
      "participationPercentage": "5.02"
    },
    {
      "firstName": "ENRIQUE",
      "lastName": "MERCADO IDARRAGA",
      "identificationType": "Cédula de Ciudadanía",
      "identificationNumber": "80134782",
      "noveltyType": "Registro",
      "participationPercentage": "10.05"
    }
  ],
  "country": "Colombia"
}