{
  "companyName": "GEOINTNETICS INTERNATIONAL, INC.",
  "documentType": "Certificado de Existencia y Representación Legal",
  "taxId": "860006152-8",
  "relatedParties": [
    {
      "firstName": "Jorge Enrique",
      "lastName": "Rodriguez Rojas",
      "identificationType": "C.C.",
      "identificationNumber": "000000017144874",
      "relationshipType": "Primer Suplente del Apoderado General Principal"
    },
    {
      "firstName": "Narciso Manuel",
      "lastName": "Chiquillo Conde",
      "identificationType": "Cédula de Ciudadanía",
      "identificationNumber": "17.124.736",
      "relationshipType": "Representante Legal"
    }
  ],
  "country": "Colombia"
}