{
  "companyName": "AEROSUPPORT S.A.S.",
  "documentType": "NIT",
  "taxId": "800.216.686-2",
  "relatedParties": [
    {
      "companyName": "GERMAN SALGADO VERGARA",
      "identificationType": "C.C.",
      "identificationNumber": "19.306.991",
      "relationshipType": "Shareholder",
      "participationPercentage": "49.50"
    },
    {
      "companyName": "GLOBAL AVIATION SUPPORT CORP",
      "identificationType": "NIT",
      "identificationNumber": "1045179-1-546162",
      "relationshipType": "Shareholder",
      "participationPercentage": "49.00"
    },
    {
      "firstName": "ADRIANA",
      "lastName": "ARANGO JARAMILLO",
      "identificationType": "C.C.",
      "identificationNumber": "35469632",
      "relationshipType": "Shareholder",
      "participationPercentage": "1.00"
    },
    {
      "companyName": "NICOLAS SALGADO ARANGO",
      "identificationType": "C.C.",
      "identificationNumber": "1020763136",
      "relationshipType": "Shareholder",
      "participationPercentage": "0.50"
    }
  ]
}