{
  "companyName": "GEOKINETICS INTERNATIONAL, INC.",
  "documentType": "NIT",
  "taxId": "860006152-8",
  "relatedParties": [
    {
      "firstName": "Jorge Enrique",
      "lastName": "Rodriguez Rojas",
      "identificationType": "C.C.",
      "identificationNumber": "17448874",
      "relationshipType": "Apoderado General Principal"
    },
    {
      "firstName": "Narciso Manuel",
      "lastName": "Chiquillo Conde",
      "identificationType": "C.C.",
      "identificationNumber": "17124736",
      "relationshipType": "Representante Legal"
    },
    {
      "firstName": "Maria Magdalena",
      "lastName": "Falla Montealegre Buistamante",
      "identificationType": "C.C.",
      "identificationNumber": "36372389",
      "relationshipType": "Revisor Fiscal Principal"
    }
  ],
  "country": "Colombia"
}